{"schema":"geometry.model_bounds.a0","units":"mm","source":{"format":"step","hash":"computed:fnv1a64:model"},"bounds":{"min":[-1.20996345469,-0.51473610875,-1.4478],"max":[1.20996345469,0.4826,1.4478],"size":[2.41992690937,0.99733610875,2.8956],"center":[0,-0.0160680543749,0]},"timings":{"model_read_ms":0,"bounds_ms":0}}
